{
  "authority": "SKILL.md",
  "buildMetadata": {
    "generatedAt": "deterministic-build",
    "generatedBy": "ztothez-design compile-authority",
    "privateSourcesIncluded": false
  },
  "compilerVersion": "1.0.0",
  "cutoverStatus": "not-authoritative-until-v5-item-8",
  "integrity": {
    "admissionSha256": "b457377a684108c5b3ba14190895d3c26b939d10723a8ed995f5ca21a2aec7ff",
    "modelSha256": "051cd3c12a54b409998a0ab1ad0336e64468c24776a0c0e345df66f8bc1650f0",
    "payloadSha256": "b84253c2d602dfc831172468c2b2cef8a01a249b75459b188b65d0ac536b0ef3",
    "retrievalScopeSha256": "0fc9c7bc9b31f76744c9c4461d22cc6b8d8309f10ef6c6a10ae01f1d129d1c9d",
    "ruleRegistrySha256": "8c9c36e279b11b6732fe8cc8c58aa7b56945f788413b4b6866ed0d2354ce9d94"
  },
  "knowledge": {
    "admittedFileCount": 142,
    "exactReadDocuments": [
      {
        "authority": "approved",
        "category": "design-intelligence",
        "path": "knowledge-base/design-intelligence/asset-generation.md",
        "sha256": "b73f6a8e3e3fe5be1a18c8dcd1b91996f0fc887126111ba1a682bdb4b9d31c2c",
        "sourceId": "admission:ztde-kb-315a74a45b2e7886"
      },
      {
        "authority": "approved",
        "category": "design-intelligence",
        "path": "knowledge-base/design-intelligence/brand-systems.md",
        "sha256": "dcd8d9c94d6de206c5e8bdc346e84b8a64fb8d16b98b6e883dfff27659066530",
        "sourceId": "admission:ztde-kb-e28110d9d442244f"
      },
      {
        "authority": "approved",
        "category": "design-intelligence",
        "path": "knowledge-base/design-intelligence/closed-loop-repair.md",
        "sha256": "af8135018aa7cb5507419623740cfa6e4a606fa4b10f843dfc54d0996ff0d699",
        "sourceId": "admission:ztde-kb-20f718fcfc85bc64"
      },
      {
        "authority": "approved",
        "category": "design-intelligence",
        "path": "knowledge-base/design-intelligence/design-plan.md",
        "sha256": "ac6f3256aa0d4874373ee1446b192fd3718b3b9edce3f29bcd2665256562f00f",
        "sourceId": "admission:ztde-kb-77334a2498717611"
      },
      {
        "authority": "approved",
        "category": "design-intelligence",
        "path": "knowledge-base/design-intelligence/figma-production.md",
        "sha256": "dc80beea9de4708f7f41c8b7b26654554bc4da7d5bd136f173290f380e72f4b0",
        "sourceId": "admission:ztde-kb-7f88ba0ba0b3c056"
      },
      {
        "authority": "approved",
        "category": "design-intelligence",
        "path": "knowledge-base/design-intelligence/generation-adapter.md",
        "sha256": "025ef0074c9e08b3859ca50811606a26d9b59eb9123e5d607d3e254d74c00127",
        "sourceId": "admission:ztde-kb-652712d011423324"
      },
      {
        "authority": "approved",
        "category": "design-intelligence",
        "path": "knowledge-base/design-intelligence/iconography.md",
        "sha256": "cd599a7bd41b0d3611b0553b4cd4cc4f0108a9328d1fe998196bc18dcede5b40",
        "sourceId": "admission:ztde-kb-4d345de283dda5d5"
      },
      {
        "authority": "approved",
        "category": "design-intelligence",
        "path": "knowledge-base/design-intelligence/information-design.md",
        "sha256": "0b47f632df787c491814d04676551692d6d8704f864288d119be1b5a6f25de04",
        "sourceId": "admission:ztde-kb-b376e85ba8146c89"
      },
      {
        "authority": "approved",
        "category": "design-intelligence",
        "path": "knowledge-base/design-intelligence/interaction-recovery-verification.md",
        "sha256": "d859e0cda735a857b2323dde30e30cc0a78adf993f63abdbff842215abc0cbb3",
        "sourceId": "admission:ztde-kb-908481a959d6eb0e"
      },
      {
        "authority": "approved",
        "category": "design-intelligence",
        "path": "knowledge-base/design-intelligence/interface-trust.md",
        "sha256": "da03468feec68eadaac067ef3eb83d58af7b897214e3e8a9a91f81d6ffde5ada",
        "sourceId": "admission:ztde-kb-5f2511315b7444f2"
      },
      {
        "authority": "approved",
        "category": "design-intelligence",
        "path": "knowledge-base/design-intelligence/licensing-and-provenance.md",
        "sha256": "41c9b8fb37e3a155c029d641cd9311ad7762b83315e7fa471fbed4c33e9bca06",
        "sourceId": "admission:ztde-kb-66598c3330028f85"
      },
      {
        "authority": "approved",
        "category": "design-intelligence",
        "path": "knowledge-base/design-intelligence/MASTER.md",
        "sha256": "b61c4a3adb12517ef283a4b2e4df60ffc6f20331c6b2cd0f7546b17f347cd076",
        "sourceId": "admission:ztde-kb-70aeea3316b92d14"
      },
      {
        "authority": "approved",
        "category": "design-intelligence",
        "path": "knowledge-base/design-intelligence/presentation-design.md",
        "sha256": "d057c7cd4e31cfb0818889401912a64d993768970337a8459904f9862576aca6",
        "sourceId": "admission:ztde-kb-08edeaad9dfb4885"
      },
      {
        "authority": "approved",
        "category": "design-intelligence",
        "path": "knowledge-base/design-intelligence/product-design-brief.md",
        "sha256": "ba2e435153a92a87e0dff543ca1b333305712111607055c2b7f4b8d7a68e0008",
        "sourceId": "admission:ztde-kb-84405b81adf83cfa"
      },
      {
        "authority": "approved",
        "category": "design-intelligence",
        "path": "knowledge-base/design-intelligence/visual-accessibility.md",
        "sha256": "67f62d0e3515199e890e2281228fb2837acfa12c8c5a9cf3d6b76da44e085dce",
        "sourceId": "admission:ztde-kb-20c7c49684873651"
      },
      {
        "authority": "approved",
        "category": "design-intelligence",
        "path": "knowledge-base/design-intelligence/visual-polish.md",
        "sha256": "836f8e250eab1997e3374dbd09c16b5c0143b4958e56f67538e6ceedea483bc6",
        "sourceId": "admission:ztde-kb-a292e8d89bb08d6a"
      },
      {
        "authority": "approved",
        "category": "architecture",
        "path": "knowledge-base/maintained/architecture/component-boundaries.md",
        "sha256": "fbfad0924d87599e4d0950f237675ed5fcc88fe0ac2e458e9e5f6fcd028d0039",
        "sourceId": "admission:ztde-kb-d5f53820992595c5"
      },
      {
        "authority": "approved",
        "category": "architecture",
        "path": "knowledge-base/maintained/architecture/MASTER.md",
        "sha256": "c831c1875477f7cea454b42c880d48c879795bbe493d4997bc6085581c851ba6",
        "sourceId": "admission:ztde-kb-07d4545108973252"
      },
      {
        "authority": "approved",
        "category": "architecture",
        "path": "knowledge-base/maintained/architecture/product-platforms.md",
        "sha256": "e73a0a8857adf5d81df1617f0118d7f892e0f2a7ba3e8b86f12a98d74d4993c1",
        "sourceId": "admission:ztde-kb-e96922b2e8aec8cc"
      },
      {
        "authority": "approved",
        "category": "architecture",
        "path": "knowledge-base/maintained/architecture/quality-attributes-and-evaluation.md",
        "sha256": "35647b5b6c87bbfa909cee09dd54237edccc40210d91eeb61bcf3dc9d84c7d29",
        "sourceId": "admission:ztde-kb-ee04c06045f7327a"
      },
      {
        "authority": "approved",
        "category": "ux-patterns",
        "path": "knowledge-base/maintained/product-patterns/ai-workspaces.md",
        "sha256": "71688250fce0d1efef4e7fe9ab95810be5f2c1de93881fbe806ce87054074fac",
        "sourceId": "admission:ztde-kb-7e1691cc7852aa2d"
      },
      {
        "authority": "approved",
        "category": "ux-patterns",
        "path": "knowledge-base/maintained/product-patterns/MASTER.md",
        "sha256": "0522f2bf5d5caa3ae5874570cb4a703755dbbe5ec056661f55b43b84771c3ede",
        "sourceId": "admission:ztde-kb-33e493591a93aedd"
      },
      {
        "authority": "approved",
        "category": "ux-patterns",
        "path": "knowledge-base/maintained/product-patterns/operational-dashboards.md",
        "sha256": "6e7a058fd1ffc6a8b2909f72fc8fafa2126d73a322b94dc9568176a48af8a8d7",
        "sourceId": "admission:ztde-kb-23679d3009a8d82b"
      },
      {
        "authority": "approved",
        "category": "usability-evaluation",
        "path": "knowledge-base/usability-evaluation/HEURISTIC_EVALUATION.md",
        "sha256": "57d4e8391cf68aa9f1ac2df1f70f50283ef2daa389e95cf358c19306d10d8f86",
        "sourceId": "admission:ztde-kb-bf8c0751ae022e49"
      }
    ],
    "retrievalDocuments": [
      {
        "authority": "approved",
        "category": "design-intelligence",
        "path": "knowledge-base/design-intelligence/asset-generation.md",
        "sha256": "b73f6a8e3e3fe5be1a18c8dcd1b91996f0fc887126111ba1a682bdb4b9d31c2c",
        "sourceId": "admission:ztde-kb-315a74a45b2e7886"
      },
      {
        "authority": "approved",
        "category": "design-intelligence",
        "path": "knowledge-base/design-intelligence/brand-systems.md",
        "sha256": "dcd8d9c94d6de206c5e8bdc346e84b8a64fb8d16b98b6e883dfff27659066530",
        "sourceId": "admission:ztde-kb-e28110d9d442244f"
      },
      {
        "authority": "approved",
        "category": "design-intelligence",
        "path": "knowledge-base/design-intelligence/closed-loop-repair.md",
        "sha256": "af8135018aa7cb5507419623740cfa6e4a606fa4b10f843dfc54d0996ff0d699",
        "sourceId": "admission:ztde-kb-20f718fcfc85bc64"
      },
      {
        "authority": "approved",
        "category": "design-intelligence",
        "path": "knowledge-base/design-intelligence/design-plan.md",
        "sha256": "ac6f3256aa0d4874373ee1446b192fd3718b3b9edce3f29bcd2665256562f00f",
        "sourceId": "admission:ztde-kb-77334a2498717611"
      },
      {
        "authority": "approved",
        "category": "design-intelligence",
        "path": "knowledge-base/design-intelligence/figma-production.md",
        "sha256": "dc80beea9de4708f7f41c8b7b26654554bc4da7d5bd136f173290f380e72f4b0",
        "sourceId": "admission:ztde-kb-7f88ba0ba0b3c056"
      },
      {
        "authority": "approved",
        "category": "design-intelligence",